{
  "name": "Sage",
  "description": "You spent your formative years traveling between manors and monasteries, performing various odd jobs and services in exchange for access to their libraries. You whiled away many a long evening studying books and scrolls, learning the lore of the multiverse—even the rudiments of magic—and your mind yearns for more.",
  "abilityScoreIncrease": {
    "choices": ["Constitution", "Intelligence", "Wisdom"],
    "points": 3
  },
  "feat": {
    "name": "Magic Initiate (Wizard)",
    "type": "Origin",
    "description": "You learn two cantrips and one 1st-level spell from the Wizard spell list. You can cast the 1st-level spell without expending a spell slot, and you must finish a Long Rest before you can cast it in this way again. You can also cast the spell using any spell slots you have. Intelligence, Wisdom, or Charisma is your spellcasting ability for these spells (choose when you select this feat)."
  },
  "skillProficiencies": ["Arcana", "History"],
  "toolProficiency": {
    "fixed": "Calligrapher's Supplies"
  },
  "languageProficiency": {
    "choice": {
      "count": 1,
      "type": "standard"
    }
  },
  "startingEquipment": {
    "options": [
      {
        "choice": "A",
        "items": [
          "Quarterstaff",
          "Calligrapher's Supplies",
          "Book (history)",
          "Parchment (8 sheets)",
          "Robe"
        ],
        "gold": 8
      },
      {
        "choice": "B",
        "items": [],
        "gold": 50
      }
    ]
  },
  "sourceBook": "Player's Handbook 2024"
}